{
  "$schema": "https://json-schema.org/draft-07/schema",
  "title": "Schema for Orbital Library",
  "type": "object",
  "default": {},
  "required": [
    "ship",
    "planets",
    "control",
    "data"
  ],
  "properties": {
    "ship": {
      "type": "object",
      "default": {},
      "title": "The ship Schema",
      "required": [
        "name",
        "position",
        "velocity",
        "mass",
        "fuel",
        "fuel_usage"
      ],
      "properties": {
        "name": {
          "type": "string",
          "default": "",
          "title": "The name Schema",
          "examples": [
            "Normandy"
          ]
        },
        "position": {
          "type": "array",
          "default": [],
          "title": "The position Schema",
          "items": {
            "type": "number",
            "title": "A Schema",
            "examples": [
              0.0
            ]
          },
          "minItems": 3,
          "maxItems": 3,
          "examples": [
            [
              0.0,
              0.0,
              0.0
            ]
          ]
        },
        "velocity": {
          "type": "array",
          "default": [],
          "title": "The velocity Schema",
          "items": {
            "type": "number",
            "title": "A Schema",
            "examples": [
              0.0
            ]
          },
          "minItems": 3,
          "maxItems": 3,
          "examples": [
            [
              0.0,
              0.0,
              0.0
            ]
          ]
        },
        "mass": {
          "type": "number",
          "default": 0.0,
          "title": "The mass Schema",
          "examples": [
            10000.0
          ]
        },
        "fuel": {
          "type": "number",
          "default": 0.0,
          "title": "The fuel Schema",
          "examples": [
            5000.0
          ]
        },
        "fuel_usage": {
          "type": "number",
          "default": 0.0,
          "title": "The fuel_usage Schema",
          "examples": [
            10.0
          ]
        }
      },
      "examples": [
        {
          "name": "Normandy",
          "position": [
            0.0,
            0.0,
            0.0
          ],
          "velocity": [
            0.0,
            0.0,
            0.0
          ],
          "mass": 10000.0,
          "fuel": 5000.0,
          "fuel_usage": 10.0
        }
      ]
    },
    "planets": {
      "type": "array",
      "default": [],
      "title": "The planets Schema",
      "items": {
        "type": "object",
        "title": "A Schema",
        "required": [
          "name",
          "mass",
          "radius",
          "position"
        ],
        "minItems": 0,
        "properties": {
          "name": {
            "type": "string",
            "title": "The name Schema",
            "examples": [
              "Eol",
              "Loki",
              "Anders"
            ]
          },
          "mass": {
            "type": "number",
            "title": "The mass Schema",
            "examples": [
              1000000.0,
              2000000.0,
              3000000.0
            ]
          },
          "radius": {
            "type": "number",
            "title": "The radius Schema",
            "examples": [
              5000.0,
              7000.0,
              6000.0
            ]
          },
          "position": {
            "type": "array",
            "title": "The position Schema",
            "items": {
              "type": "number",
              "title": "A Schema",
              "examples": [
                10000.0,
                200.0,
                200000.0,
                2000.0,
                300000.0,
                300.0
              ]
            },
            "minItems": 3,
            "maxItems": 3,
            "examples": [
              [
                10000.0,
                10000.0,
                10000.0
              ],
              [
                200.0,
                200000.0,
                2000.0
              ],
              [
                300000.0,
                300.0,
                300000.0
              ]
            ]
          }
        },
        "examples": [
          {
            "name": "Eol",
            "mass": 1000000.0,
            "radius": 5000.0,
            "position": [
              10000.0,
              10000.0,
              10000.0
            ]
          },
          {
            "name": "Loki",
            "mass": 2000000.0,
            "radius": 7000.0,
            "position": [
              200.0,
              200000.0,
              2000.0
            ]
          },
          {
            "name": "Anders",
            "mass": 3000000.0,
            "radius": 6000.0,
            "position": [
              300000.0,
              300.0,
              300000.0
            ]
          }
        ]
      },
      "examples": [
        [
          {
            "name": "Eol",
            "mass": 1000000.0,
            "radius": 5000.0,
            "position": [
              10000.0,
              10000.0,
              10000.0
            ]
          },
          {
            "name": "Loki",
            "mass": 2000000.0,
            "radius": 7000.0,
            "position": [
              200.0,
              200000.0,
              2000.0
            ]
          },
          {
            "name": "Anders",
            "mass": 3000000.0,
            "radius": 6000.0,
            "position": [
              300000.0,
              300.0,
              300000.0
            ]
          }
        ]
      ]
    },
    "control": {
      "type": "array",
      "default": [],
      "title": "The control Schema",
      "items": {
        "type": "object",
        "title": "A Schema",
        "required": [
          "starttime",
          "endtime",
          "force"
        ],
        "minItems": 0,
        "properties": {
          "starttime": {
            "type": "array",
            "title": "The starttime Schema",
            "items": {
              "type": "number",
              "title": "A Schema",
              "examples": [
                0.0,
                30.0,
                80.0,
                90.0
              ]
            },
            "minItems": 3,
            "maxItems": 3,
            "examples": [
              [
                0.0,
                0.0,
                0.0
              ],
              [
                30.0,
                30.0,
                30.0
              ],
              [
                80.0,
                80.0,
                90.0
              ]
            ]
          },
          "endtime": {
            "type": "array",
            "title": "The endtime Schema",
            "items": {
              "type": "number",
              "title": "A Schema",
              "examples": [
                10.0,
                60.0,
                100.0
              ]
            },
            "minItems": 3,
            "maxItems": 3,
            "examples": [
              [
                10.0,
                10.0,
                10.0
              ],
              [
                60.0,
                60.0,
                60.0
              ],
              [
                100.0,
                100.0,
                100.0
              ]
            ]
          },
          "force": {
            "type": "array",
            "title": "The force Schema",
            "items": {
              "type": "number",
              "title": "A Schema",
              "examples": [
                200.0,
                100.0,
                0.0,
                300.0
              ]
            },
            "minItems": 3,
            "maxItems": 3,
            "examples": [
              [
                200.0,
                100.0,
                0.0
              ],
              [
                0.0,
                100.0,
                300.0
              ],
              [
                100.0,
                100.0,
                100.0
              ]
            ]
          }
        },
        "examples": [
          {
            "starttime": [
              0.0,
              0.0,
              0.0
            ],
            "endtime": [
              10.0,
              10.0,
              10.0
            ],
            "force": [
              200.0,
              100.0,
              0.0
            ]
          },
          {
            "starttime": [
              30.0,
              30.0,
              30.0
            ],
            "endtime": [
              60.0,
              60.0,
              60.0
            ],
            "force": [
              0.0,
              100.0,
              300.0
            ]
          },
          {
            "starttime": [
              80.0,
              80.0,
              90.0
            ],
            "endtime": [
              100.0,
              100.0,
              100.0
            ],
            "force": [
              100.0,
              100.0,
              100.0
            ]
          }
        ]
      },
      "examples": [
        [
          {
            "starttime": [
              0.0,
              0.0,
              0.0
            ],
            "endtime": [
              10.0,
              10.0,
              10.0
            ],
            "force": [
              200.0,
              100.0,
              0.0
            ]
          },
          {
            "starttime": [
              30.0,
              30.0,
              30.0
            ],
            "endtime": [
              60.0,
              60.0,
              60.0
            ],
            "force": [
              0.0,
              100.0,
              300.0
            ]
          },
          {
            "starttime": [
              80.0,
              80.0,
              90.0
            ],
            "endtime": [
              100.0,
              100.0,
              100.0
            ],
            "force": [
              100.0,
              100.0,
              100.0
            ]
          }
        ]
      ]
    },
    "data": {
      "type": "object",
      "default": {},
      "title": "The data Schema",
      "required": [
        "time",
        "step",
        "ode"
      ],
      "properties": {
        "time": {
          "type": "number",
          "default": 0.0,
          "title": "The time Schema",
          "examples": [
            120.0
          ]
        },
        "step": {
          "type": "number",
          "default": 0.0,
          "title": "The step Schema",
          "examples": [
            1.0
          ]
        },
        "ode": {
          "type": "integer",
          "default": 0,
          "enum": [0, 1, 2, 3],
          "title": "The ode Schema",
          "examples": [
            3
          ]
        }
      },
      "examples": [
        {
          "time": 120.0,
          "step": 1.0,
          "ode": 3
        }
      ]
    }
  },
  "examples": [
    {
      "ship": {
        "name": "Normandy",
        "position": [
          0.0,
          0.0,
          0.0
        ],
        "velocity": [
          0.0,
          0.0,
          0.0
        ],
        "mass": 10000.0,
        "fuel": 5000.0,
        "fuel_usage": 10.0
      },
      "planets": [
        {
          "name": "Eol",
          "mass": 1000000.0,
          "radius": 5000.0,
          "position": [
            10000.0,
            10000.0,
            10000.0
          ]
        },
        {
          "name": "Loki",
          "mass": 2000000.0,
          "radius": 7000.0,
          "position": [
            200.0,
            200000.0,
            2000.0
          ]
        },
        {
          "name": "Anders",
          "mass": 3000000.0,
          "radius": 6000.0,
          "position": [
            300000.0,
            300.0,
            300000.0
          ]
        }
      ],
      "control": [
        {
          "starttime": [
            0.0,
            0.0,
            0.0
          ],
          "endtime": [
            10.0,
            10.0,
            10.0
          ],
          "force": [
            200.0,
            100.0,
            0.0
          ]
        },
        {
          "starttime": [
            30.0,
            30.0,
            30.0
          ],
          "endtime": [
            60.0,
            60.0,
            60.0
          ],
          "force": [
            0.0,
            100.0,
            300.0
          ]
        },
        {
          "starttime": [
            80.0,
            80.0,
            90.0
          ],
          "endtime": [
            100.0,
            100.0,
            100.0
          ],
          "force": [
            100.0,
            100.0,
            100.0
          ]
        }
      ],
      "data": {
        "time": 120.0,
        "step": 1.0,
        "ode": 3
      }
    }
  ]
}

  
    



