{
  "control": [
    {
      "endtime": [
        0.0,
        14315.0,
        0.0
      ],
      "force": [
        0.0,
        368000.00,
        0.0
      ],
      "starttime": [
        0.0,
        14300.0,
        0.0
      ]
    },
    {
      "endtime": [
        0.0,
        33120.0,
        0.0
      ],
      "force": [
        0.0,
        -202000.0,
        0.0
      ],
      "starttime": [
        0.0,
        33105.0,
        0.0
      ]
    },
    {
      "endtime": [
        0.0,
        60238.0,
        0.0
      ],
      "force": [
        0.0,
        -50000,
        0.0
      ],
      "starttime": [
        0.0,
        60223.0,
        0.0
      ]
    }
  ],
  "data": {
    "ode": 3,
    "step": 1,
    "time": 110000
  },
  "planets": [
    {
      "name": "Earth",
      "mass": 5.972e24,
      "radius": 6.378e6,
      "orbit": false,
      "position": [
        0.0,
        0.0,
        0.0
      ]
    }
  ],
  "ship": {
    "fuel": 2000.0,
    "fuel_usage": 5.0,
    "mass": 5000.0,
    "name": "Sim6",
    "position": [
      12742000.0,
      0.0,
      0.0
    ],
    "velocity": [
      0.0,
      5592.27,
      0.0
    ]
  }
}
