{
    "control": [
        {
            "endtime": [
                50.0,
                0.0,
                0.0
            ],
            "force": [
                500.0,
                0.0,
                0.0
            ],
            "starttime": [
                0.0,
                0.0,
                0.0
            ]
        }
    ],
    "data": {
        "ode": 2,
        "step": 0.1,
        "time": 50.0
    },
    "planets": [
      
    ],
    "ship": {
        "fuel": 500.0,
        "fuel_usage": 10.0,
        "mass": 10000.0,
        "name": "TestCase1",
        "position": [
            0.0,
            0.0,
            0.0
        ],
        "velocity": [
            0.0,
            0.0,
            0.0
        ]
    }
}
