{
  "control": [
    {
      "endtime": [
        0.0,
        0.0,
        0.0
      ],
      "force": [
        0.0,
        0.0,
        0.0
      ],
      "starttime": [
        0.0,
        0.0,
        0.0
      ]
    }
  ],
  "data": {
    "ode": 3,
    "step": 1,
    "time": 513
  },
  "planets": [
    {
      "name": "Earth",
      "mass": 5972200000000000000000000.0,
      "radius": 6371000,
      "position": [
        0.0,
        0.0,
        0.0
      ]
    }
  ],
  "ship": {
    "fuel": 0.0,
    "fuel_usage": 0.0,
    "mass": 10000.0,
    "name": "TestCase2",
    "position": [
      6371000.0,
      0.0,
      0.0
    ],
    "velocity": [
      11200.0,
      0.0,
      0.0
    ]
  }
}
