{
  "control": [
    {
      "endtime": [
        0.0,
        465.0,
        0.0
      ],
      "force": [
        0.0,
        15418.6,
        0.0
      ],
      "starttime": [
        0.0,
        0.0,
        0.0
      ]
    }
  ],
  "data": {
    "ode": 0,
    "step": 1,
    "time": 465.0
  },
  "planets": [
    {
      "name": "Moon",
      "mass": 73460000000000000000000.0,
      "radius": 1738100.0,
      "position": [
        0.0,
        0.0,
        0.0
      ]
    }
      ],
      "ship": {
        "fuel": 2350.0,
        "fuel_usage": 5.05376,
        "mass": 4500.0,
        "name": "TestCase3",
        "position": [
          0.0,
          1738100.0,
          0.0
        ],
        "velocity": [
          0.0,
          0.0,
          0.0
        ]
      }
    }
