{
    "control": [
        {
            "endtime": [
                20.0,
                20.0,
                20.0
            ],
            "force": [
                10.0,
                10.0,
                10.0
            ],
            "starttime": [
                10.0,
                10.0,
                10.0
            ]
        },
        {
            "endtime": [
                30.0,
                30.0,
                30.0
            ],
            "force": [
                -10.0,
                -10.0,
                -10.0
            ],
            "starttime": [
                20.0,
                20.0,
                20.0
            ]
        },
        {
            "endtime": [
                60.0,
                60.0,
                60.0
            ],
            "force": [
                5.0,
                5.0,
                5.0
            ],
            "starttime": [
                40.0,
                40.0,
                40.0
            ]
        }
    ],
    "data": {
        "ode": 2,
        "step": 0.5,
        "time": 100.0
    },
    "planets": [
        {
            "mass": 1000000.0,
            "name": "Kirkstone",
            "position": [
                20000.0,
                20000.0,
                20000.0
            ],
            "radius": 5000.0
        },
        {
            "mass": 200000.0,
            "name": "Dunfell",
            "position": [
                -10000.0,
                -10000.0,
                -10000.0
            ],
            "radius": 3000.0
        }
    ],
    "ship": {
        "fuel": 5000.0,
        "fuel_usage": 10.0,
        "mass": 15000.0,
        "name": "Test4",
        "position": [
            0.0,
            0.0,
            0.0
        ],
        "velocity": [
            10.0,
            10.0,
            10.0
        ]
    }
}
